{
  "id": "generic.altimeter-80",
  "version": 1,
  "maker": "Generic",
  "model": "80 mm altimeter",
  "category": "instrument",
  "description": "Mechanical altimeter, 80 mm, with a static port.",
  "generator": "generic.altimeter-80",
  "params": {
    "cutoutD": {
      "label": "Cutout diameter",
      "value": 80,
      "unit": "mm",
      "min": 0.1
    },
    "bezel": {
      "label": "Bezel size",
      "value": 81,
      "unit": "mm",
      "min": 0.1
    },
    "bezelR": {
      "label": "Bezel corner radius",
      "value": 5,
      "unit": "mm",
      "min": 0
    },
    "screwSpacing": {
      "label": "Screw spacing (square)",
      "value": 66,
      "unit": "mm",
      "min": 0.1
    },
    "screwD": {
      "label": "Screw hole diameter",
      "value": 4.2,
      "unit": "mm",
      "min": 0.1
    },
    "bodyD": {
      "label": "Body diameter",
      "value": 80,
      "unit": "mm",
      "min": 0.1
    },
    "depth": {
      "label": "Body depth",
      "value": 120,
      "unit": "mm",
      "min": 0.1
    },
    "protrusion": {
      "label": "Protrusion",
      "value": 10,
      "unit": "mm",
      "min": 0
    }
  },
  "connectors": [],
  "ports": [
    {
      "id": "S",
      "kind": "static",
      "fitting": null,
      "x": 0,
      "y": -25
    }
  ],
  "power": null,
  "weightG": null,
  "datasheet": null,
  "offPanel": false,
  "front": {
    "cutouts": [
      {
        "kind": "circle",
        "cx": 0,
        "cy": 0,
        "d": 80
      }
    ],
    "bezel": {
      "kind": "rect",
      "cx": 0,
      "cy": 0,
      "w": 81,
      "h": 81,
      "r": 5
    },
    "screwHoles": [
      {
        "x": -33,
        "y": 33,
        "d": 4.2
      },
      {
        "x": 33,
        "y": 33,
        "d": 4.2
      },
      {
        "x": -33,
        "y": -33,
        "d": 4.2
      },
      {
        "x": 33,
        "y": -33,
        "d": 4.2
      }
    ],
    "protrusion": 10
  },
  "rear": {
    "body": {
      "kind": "circle",
      "cx": 0,
      "cy": 0,
      "d": 80
    },
    "depth": 120,
    "bracketPoints": []
  },
  "sources": {
    "front.cutouts": {
      "url": null,
      "snippet": null,
      "status": "unverified",
      "note": "Generic placeholder default. Check against the real part or its datasheet before cutting."
    },
    "front.bezel": {
      "url": null,
      "snippet": null,
      "status": "unverified",
      "note": "Generic placeholder default. Check against the real part or its datasheet before cutting."
    },
    "front.screwHoles": {
      "url": null,
      "snippet": null,
      "status": "unverified",
      "note": "Estimated from a photo of 57 and 80 mm panel-marking templates (no scale reference, about ±3 mm). Measure your instrument or template before drilling."
    },
    "front.protrusion": {
      "url": null,
      "snippet": null,
      "status": "unverified",
      "note": "Generic placeholder default. Check against the real part or its datasheet before cutting."
    },
    "rear.body": {
      "url": null,
      "snippet": null,
      "status": "unverified",
      "note": "Generic placeholder default. Check against the real part or its datasheet before cutting."
    },
    "rear.depth": {
      "url": null,
      "snippet": null,
      "status": "unverified",
      "note": "Generic placeholder default. Check against the real part or its datasheet before cutting."
    },
    "ports": {
      "url": null,
      "snippet": null,
      "status": "unverified",
      "note": "Generic placeholder default. Check against the real part or its datasheet before cutting."
    }
  },
  "review": "unverified"
}
