{
  "id": "generic.antenna",
  "version": 1,
  "maker": "Generic",
  "model": "Antenna",
  "category": "antenna",
  "description": "Antenna (VHF, FLARM or transponder), off the panel.",
  "generator": "generic.antenna",
  "params": {},
  "connectors": [
    {
      "id": "ANT",
      "type": "coax",
      "x": 0,
      "y": 0,
      "face": "rear",
      "clearance": null,
      "pins": [
        {
          "number": "RF",
          "function": "antenna",
          "signal": "rf",
          "direction": "bidi"
        }
      ]
    }
  ],
  "ports": [],
  "power": null,
  "weightG": null,
  "datasheet": null,
  "offPanel": true,
  "front": {
    "cutouts": [],
    "bezel": null,
    "screwHoles": [],
    "protrusion": 0
  },
  "rear": {
    "body": null,
    "depth": null,
    "bracketPoints": []
  },
  "sources": {
    "front.cutouts": {
      "url": null,
      "snippet": null,
      "status": "unverified",
      "note": "Generic placeholder default. Check against the real part or its datasheet before cutting."
    },
    "front.bezel": {
      "url": null,
      "snippet": null,
      "status": "unverified",
      "note": "Generic placeholder default. Check against the real part or its datasheet before cutting."
    },
    "front.screwHoles": {
      "url": null,
      "snippet": null,
      "status": "unverified",
      "note": "Generic placeholder default. Check against the real part or its datasheet before cutting."
    },
    "front.protrusion": {
      "url": null,
      "snippet": null,
      "status": "unverified",
      "note": "Generic placeholder default. Check against the real part or its datasheet before cutting."
    },
    "rear.body": {
      "url": null,
      "snippet": null,
      "status": "unverified",
      "note": "Generic placeholder default. Check against the real part or its datasheet before cutting."
    },
    "rear.depth": {
      "url": null,
      "snippet": null,
      "status": "unverified",
      "note": "Generic placeholder default. Check against the real part or its datasheet before cutting."
    },
    "connectors": {
      "url": null,
      "snippet": null,
      "status": "unverified",
      "note": "Generic placeholder default. Check against the real part or its datasheet before cutting."
    }
  },
  "review": "unverified"
}
