{
  "id": "flarm.powerflarm-fusion",
  "version": 1,
  "maker": "FLARM",
  "model": "PowerFLARM Fusion",
  "category": "flarm",
  "front": {
    "cutouts": [],
    "bezel": {
      "kind": "rect",
      "cx": 0,
      "cy": 0,
      "w": 119,
      "h": 80,
      "r": 0
    },
    "screwHoles": [],
    "protrusion": null
  },
  "rear": {
    "body": null,
    "depth": 42,
    "bracketPoints": []
  },
  "connectors": [],
  "ports": [],
  "power": {
    "currentA": 0.18,
    "voltage": 12
  },
  "weightG": 250,
  "datasheet": "https://www.flarm.com/wp-content/uploads/2024/03/FTD-077-PowerFLARM-Fusion-Installation-Manual.pdf",
  "sources": {
    "front.bezel": {
      "url": "https://www.flarm.com/wp-content/uploads/2024/03/FTD-077-PowerFLARM-Fusion-Installation-Manual.pdf",
      "snippet": "Dimensions 119 x 80 x 42 mm",
      "status": "verified",
      "note": "Page 26. First two figures of W × H × D, taken as the front face."
    },
    "rear.depth": {
      "url": "https://www.flarm.com/wp-content/uploads/2024/03/FTD-077-PowerFLARM-Fusion-Installation-Manual.pdf",
      "snippet": "Dimensions 119 x 80 x 42 mm",
      "status": "verified",
      "note": "Page 26. Third figure of W × H × D. Check whether it is depth behind the panel or overall."
    },
    "weightG": {
      "url": "https://www.flarm.com/wp-content/uploads/2024/03/FTD-077-PowerFLARM-Fusion-Installation-Manual.pdf",
      "snippet": "Mass 250 g",
      "status": "verified",
      "note": "Page 26."
    },
    "power.currentA": {
      "url": "https://www.flarm.com/wp-content/uploads/2024/03/FTD-077-PowerFLARM-Fusion-Installation-Manual.pdf",
      "snippet": "Typical current drain is 180 mA @ 12 V, less for",
      "status": "verified",
      "note": "Page 15."
    },
    "power.voltage": {
      "url": "https://www.flarm.com/wp-content/uploads/2024/03/FTD-077-PowerFLARM-Fusion-Installation-Manual.pdf",
      "snippet": "Typical current drain is 180 mA @ 12 V, less for",
      "status": "verified",
      "note": "Page 15. The voltage the current was quoted at."
    },
    "datasheet": {
      "url": "https://www.flarm.com/wp-content/uploads/2024/03/FTD-077-PowerFLARM-Fusion-Installation-Manual.pdf",
      "snippet": "PowerFLARM Fusion Installation Manual",
      "status": "verified"
    }
  },
  "review": "verified",
  "offPanel": false
}
